ObservationLocation                    ,ObservationCode,ObservationURL,ObservationState
Bay Bridge Field (KW29),KW29,http://w1.weather.gov/xml/current_obs/display.php?stid=KW29,MD
Cambridge-Dorchester Airport (KCGE),KCGE,http://w1.weather.gov/xml/current_obs/display.php?stid=KCGE,MD
Camp David (KRSP),KRSP,http://w1.weather.gov/xml/current_obs/display.php?stid=KRSP,MD
Camp Springs / Andrews Air Force Base (KADW),KADW,http://w1.weather.gov/xml/current_obs/display.php?stid=KADW,MD
Carroll County Regional Jack B Poage Field (KDMW),KDMW,http://w1.weather.gov/xml/current_obs/display.php?stid=KDMW,MD
College Park Airport (KCGS),KCGS,http://w1.weather.gov/xml/current_obs/display.php?stid=KCGS,MD
Easton / Newman Field (KESN),KESN,http://w1.weather.gov/xml/current_obs/display.php?stid=KESN,MD
Fort Meade / Tipton (KFME),KFME,http://w1.weather.gov/xml/current_obs/display.php?stid=KFME,MD
Frederick Municipal Airport (KFDK),KFDK,http://w1.weather.gov/xml/current_obs/display.php?stid=KFDK,MD
Gaithersburg - Montgomery County Airport (KGAI),KGAI,http://w1.weather.gov/xml/current_obs/display.php?stid=KGAI,MD
Garrett County Airport (K2G4),K2G4,http://w1.weather.gov/xml/current_obs/display.php?stid=K2G4,MD
"Hagerstown, Washington County Regional Airport (KHGR)",KHGR,http://w1.weather.gov/xml/current_obs/display.php?stid=KHGR,MD
"Ocean City, Ocean City Municipal Airport (KOXB)",KOXB,http://w1.weather.gov/xml/current_obs/display.php?stid=KOXB,MD
"Patuxent River, Naval Air Station (KNHK)",KNHK,http://w1.weather.gov/xml/current_obs/display.php?stid=KNHK,MD
Phillips Army Air Field / Aberdeen (KAPG),KAPG,http://w1.weather.gov/xml/current_obs/display.php?stid=KAPG,MD
"Salisbury, Salisbury-Ocean City Wicomico County Regional Airport (KSBY)",KSBY,http://w1.weather.gov/xml/current_obs/display.php?stid=KSBY,MD
St Marys County Airport (K2W6),K2W6,http://w1.weather.gov/xml/current_obs/display.php?stid=K2W6,MD
"St. Inigoes, Webster Field, Naval Electronic Systems Engineering Activity (KNUI)",KNUI,http://w1.weather.gov/xml/current_obs/display.php?stid=KNUI,MD
Auburn-Lewiston (KLEW),KLEW,http://w1.weather.gov/xml/current_obs/display.php?stid=KLEW,ME
"Augusta, Augusta State Airport (KAUG)",KAUG,http://w1.weather.gov/xml/current_obs/display.php?stid=KAUG,ME
"Bangor, Bangor International Airport (KBGR)",KBGR,http://w1.weather.gov/xml/current_obs/display.php?stid=KBGR,ME
"Bar Harbor, Hancock County-Bar Harbor Airport (KBHB)",KBHB,http://w1.weather.gov/xml/current_obs/display.php?stid=KBHB,ME
"Caribou, Caribou Municipal Airport (KCAR)",KCAR,http://w1.weather.gov/xml/current_obs/display.php?stid=KCAR,ME
Clayton Lake (K40B),K40B,http://w1.weather.gov/xml/current_obs/display.php?stid=K40B,ME
"Frenchville, Northern Aroostook Regional Airport (KFVE)",KFVE,http://w1.weather.gov/xml/current_obs/display.php?stid=KFVE,ME
"Fryeburg, Eastern Slopes Regional Airport (KIZG)",KIZG,http://w1.weather.gov/xml/current_obs/display.php?stid=KIZG,ME
Greenville (KGNR),KGNR,http://w1.weather.gov/xml/current_obs/display.php?stid=KGNR,ME
"Houlton, Houlton International Airport (KHUL)",KHUL,http://w1.weather.gov/xml/current_obs/display.php?stid=KHUL,ME
"Millinocket, Millinocket Municipal Airport (KMLT)",KMLT,http://w1.weather.gov/xml/current_obs/display.php?stid=KMLT,ME
"Portland, Portland International Jetport (KPWM)",KPWM,http://w1.weather.gov/xml/current_obs/display.php?stid=KPWM,ME
Presque Isle (KPQI),KPQI,http://w1.weather.gov/xml/current_obs/display.php?stid=KPQI,ME
Rangeley - Steven A Bean Municipal Airport (K8B0),K8B0,http://w1.weather.gov/xml/current_obs/display.php?stid=K8B0,ME
"Rockland, Knox County Regional Airport (KRKD)",KRKD,http://w1.weather.gov/xml/current_obs/display.php?stid=KRKD,ME
"Sanford, Sanford Regional Airport (KSFM)",KSFM,http://w1.weather.gov/xml/current_obs/display.php?stid=KSFM,ME
"Waterville, Waterville Robert LaFleur Airport (KWVL)",KWVL,http://w1.weather.gov/xml/current_obs/display.php?stid=KWVL,ME
Wiscasset Airport (KIWI),KIWI,http://w1.weather.gov/xml/current_obs/display.php?stid=KIWI,ME
"Adrian, Lenawee County Airport (KADG)",KADG,http://w1.weather.gov/xml/current_obs/display.php?stid=KADG,MI
"Alma, Gratiot Community Airport (KAMN)",KAMN,http://w1.weather.gov/xml/current_obs/display.php?stid=KAMN,MI
"Alpena, Alpena County Regional Airport (KAPN)",KAPN,http://w1.weather.gov/xml/current_obs/display.php?stid=KAPN,MI
"Ann Arbor, Ann Arbor Municipal Airport (KARB)",KARB,http://w1.weather.gov/xml/current_obs/display.php?stid=KARB,MI
"Beaver Island, Beaver Island Airport (KSJX)",KSJX,http://w1.weather.gov/xml/current_obs/display.php?stid=KSJX,MI
"Bellaire, Antrim County Airport (KACB)",KACB,http://w1.weather.gov/xml/current_obs/display.php?stid=KACB,MI
"Big Rapids, Roben-Hood Airport (KRQB)",KRQB,http://w1.weather.gov/xml/current_obs/display.php?stid=KRQB,MI
Branch County Memorial Airport (KOEB),KOEB,http://w1.weather.gov/xml/current_obs/display.php?stid=KOEB,MI
Brooks Field Airport (KRMY),KRMY,http://w1.weather.gov/xml/current_obs/display.php?stid=KRMY,MI
Capital Region International Airport (KLAN),KLAN,http://w1.weather.gov/xml/current_obs/display.php?stid=KLAN,MI
"Caro, Tuscola Area Airport (KCFS)",KCFS,http://w1.weather.gov/xml/current_obs/display.php?stid=KCFS,MI
"Charlevoix, Charlevoix Municipal Airport (KCVX)",KCVX,http://w1.weather.gov/xml/current_obs/display.php?stid=KCVX,MI
"Charlotte, Fitch H Beach Airport (KFPK)",KFPK,http://w1.weather.gov/xml/current_obs/display.php?stid=KFPK,MI
"Cheboygan, Cheboygan County Airport (KSLH)",KSLH,http://w1.weather.gov/xml/current_obs/display.php?stid=KSLH,MI
Cherry Capital Airport (KTVC),KTVC,http://w1.weather.gov/xml/current_obs/display.php?stid=KTVC,MI
Coleman A Young Municipal Airport (KDET),KDET,http://w1.weather.gov/xml/current_obs/display.php?stid=KDET,MI
Copper Harbor (KP59),KP59,http://w1.weather.gov/xml/current_obs/display.php?stid=KP59,MI
"Detroit, Detroit Metropolitan Wayne County Airport (KDTW)",KDTW,http://w1.weather.gov/xml/current_obs/display.php?stid=KDTW,MI
"Detroit, Willow Run Airport (KYIP)",KYIP,http://w1.weather.gov/xml/current_obs/display.php?stid=KYIP,MI
"Detroit/Grosse Ile, Grosse Ile Airport (KONZ)",KONZ,http://w1.weather.gov/xml/current_obs/display.php?stid=KONZ,MI
Drummond Island Airport (KDRM),KDRM,http://w1.weather.gov/xml/current_obs/display.php?stid=KDRM,MI
Escanaba (KESC),KESC,http://w1.weather.gov/xml/current_obs/display.php?stid=KESC,MI
"Flint, Bishop International Airport (KFNT)",KFNT,http://w1.weather.gov/xml/current_obs/display.php?stid=KFNT,MI
"Frankfort, Frankfort Dow Memorial Field Airport (KFKS)",KFKS,http://w1.weather.gov/xml/current_obs/display.php?stid=KFKS,MI
Fremont Municipal Airport (KFFX),KFFX,http://w1.weather.gov/xml/current_obs/display.php?stid=KFFX,MI
Gaylord Regional Airport (KGLR),KGLR,http://w1.weather.gov/xml/current_obs/display.php?stid=KGLR,MI
"Grand Rapids, Gerald R. Ford International Airport (KGRR)",KGRR,http://w1.weather.gov/xml/current_obs/display.php?stid=KGRR,MI
"Grayling, Grayling Army Airfield (KGOV)",KGOV,http://w1.weather.gov/xml/current_obs/display.php?stid=KGOV,MI
Haines Memorial Airport (KHAI),KHAI,http://w1.weather.gov/xml/current_obs/display.php?stid=KHAI,MI
"Harbor Springs, Harbor Springs Airport (KMGN)",KMGN,http://w1.weather.gov/xml/current_obs/display.php?stid=KMGN,MI
Hillsdale Municipal Airport (KJYM),KJYM,http://w1.weather.gov/xml/current_obs/display.php?stid=KJYM,MI
Holland - West Michigan Regional Airport (KBIV),KBIV,http://w1.weather.gov/xml/current_obs/display.php?stid=KBIV,MI
Houghton County Memorial Airport (KCMX),KCMX,http://w1.weather.gov/xml/current_obs/display.php?stid=KCMX,MI
"Houghton Lake, Roscommon County Airport (KHTL)",KHTL,http://w1.weather.gov/xml/current_obs/display.php?stid=KHTL,MI
"Howell, Livingston County Airport (KOZW)",KOZW,http://w1.weather.gov/xml/current_obs/display.php?stid=KOZW,MI
Huron County Memorial Airport (KBAX),KBAX,http://w1.weather.gov/xml/current_obs/display.php?stid=KBAX,MI
Ionia County Airport (KY70),KY70,http://w1.weather.gov/xml/current_obs/display.php?stid=KY70,MI
"Iron Mountain / Kingsford, Ford Airport (KIMT)",KIMT,http://w1.weather.gov/xml/current_obs/display.php?stid=KIMT,MI
"Ironwood, Gogebic-Iron County Airport (KIWD)",KIWD,http://w1.weather.gov/xml/current_obs/display.php?stid=KIWD,MI
Jack Barstow Airport (KIKW),KIKW,http://w1.weather.gov/xml/current_obs/display.php?stid=KIKW,MI
Jackson County Airport - Reynolds Field (KJXN),KJXN,http://w1.weather.gov/xml/current_obs/display.php?stid=KJXN,MI
Kalamazoo/Battle Creek International Airport (KAZO),KAZO,http://w1.weather.gov/xml/current_obs/display.php?stid=KAZO,MI
"Lambertville, Toledo Suburban Airport (KDUH)",KDUH,http://w1.weather.gov/xml/current_obs/display.php?stid=KDUH,MI
Lapeer Dupont-lapeer (KD95),KD95,http://w1.weather.gov/xml/current_obs/display.php?stid=KD95,MI
"Ludington, Mason County Airport (KLDM)",KLDM,http://w1.weather.gov/xml/current_obs/display.php?stid=KLDM,MI
Mackinac Island Airport (KMCD),KMCD,http://w1.weather.gov/xml/current_obs/display.php?stid=KMCD,MI
Manistee County - Blacker Airport (KMBL),KMBL,http://w1.weather.gov/xml/current_obs/display.php?stid=KMBL,MI
"Manistique, Schoolcraft County Airport (KISQ)",KISQ,http://w1.weather.gov/xml/current_obs/display.php?stid=KISQ,MI
"Marquette, Sawyer International Airport (KSAW)",KSAW,http://w1.weather.gov/xml/current_obs/display.php?stid=KSAW,MI
"Mason, Mason Jewett Field Airport (KTEW)",KTEW,http://w1.weather.gov/xml/current_obs/display.php?stid=KTEW,MI
MBS International Airport (KMBS),KMBS,http://w1.weather.gov/xml/current_obs/display.php?stid=KMBS,MI
Menominee - Marinette Twin County Airport (KMNM),KMNM,http://w1.weather.gov/xml/current_obs/display.php?stid=KMNM,MI
"Monroe, Custer Airport (KTTF)",KTTF,http://w1.weather.gov/xml/current_obs/display.php?stid=KTTF,MI
"Mount Pleasant, Mount Pleasant Municipal Airport (KMOP)",KMOP,http://w1.weather.gov/xml/current_obs/display.php?stid=KMOP,MI
Munising - Munising Lakeshore Observation (KP53),KP53,http://w1.weather.gov/xml/current_obs/display.php?stid=KP53,MI
"Muskegon, Muskegon County Airport (KMKG)",KMKG,http://w1.weather.gov/xml/current_obs/display.php?stid=KMKG,MI
"Newberry, Luce County Airport (KERY)",KERY,http://w1.weather.gov/xml/current_obs/display.php?stid=KERY,MI
"Oscoda, Oscoda-Wurtsmith Airport (KOSC)",KOSC,http://w1.weather.gov/xml/current_obs/display.php?stid=KOSC,MI
"Owosso, Owosso Community Airport (KRNP)",KRNP,http://w1.weather.gov/xml/current_obs/display.php?stid=KRNP,MI
Pellston Regional Airport of Emmet County (KPLN),KPLN,http://w1.weather.gov/xml/current_obs/display.php?stid=KPLN,MI
"Pontiac, Oakland County International Airport (KPTK)",KPTK,http://w1.weather.gov/xml/current_obs/display.php?stid=KPTK,MI
Port Hope (KP58),KP58,http://w1.weather.gov/xml/current_obs/display.php?stid=KP58,MI
"Rogers City, Presque Isle County Airport (KPZQ)",KPZQ,http://w1.weather.gov/xml/current_obs/display.php?stid=KPZQ,MI
Saginaw County H W Browne Airport (KHYX),KHYX,http://w1.weather.gov/xml/current_obs/display.php?stid=KHYX,MI
"Sault Ste Marie, Chippewa County International Airport (KCIU)",KCIU,http://w1.weather.gov/xml/current_obs/display.php?stid=KCIU,MI
Sault Ste. Marie (KANJ),KANJ,http://w1.weather.gov/xml/current_obs/display.php?stid=KANJ,MI
Selfridge Air National Guard Base (KMTC),KMTC,http://w1.weather.gov/xml/current_obs/display.php?stid=KMTC,MI
"South Haven, South Haven Area Regional Airport (KLWA)",KLWA,http://w1.weather.gov/xml/current_obs/display.php?stid=KLWA,MI
Southwest Michigan Regional Airport (KBEH),KBEH,http://w1.weather.gov/xml/current_obs/display.php?stid=KBEH,MI
St Clair County International Airport (KPHN),KPHN,http://w1.weather.gov/xml/current_obs/display.php?stid=KPHN,MI
"Sturgis, Kirsch Municipal Airport (KIRS)",KIRS,http://w1.weather.gov/xml/current_obs/display.php?stid=KIRS,MI
"Troy, Oakland/Troy Airport (KVLL)",KVLL,http://w1.weather.gov/xml/current_obs/display.php?stid=KVLL,MI
W K Kellogg Airport (KBTL),KBTL,http://w1.weather.gov/xml/current_obs/display.php?stid=KBTL,MI
West Branch Community Airport (KY31),KY31,http://w1.weather.gov/xml/current_obs/display.php?stid=KY31,MI
Wexford County Airport (KCAD),KCAD,http://w1.weather.gov/xml/current_obs/display.php?stid=KCAD,MI
Aitkin Municipal Airport - Steve Kurtz Field (KAIT),KAIT,http://w1.weather.gov/xml/current_obs/display.php?stid=KAIT,MN
"Albert Lea, Albert Lea Municipal Airport (KAEL)",KAEL,http://w1.weather.gov/xml/current_obs/display.php?stid=KAEL,MN
"Alexandria, Chandler Field (KAXN)",KAXN,http://w1.weather.gov/xml/current_obs/display.php?stid=KAXN,MN
Appleton Municipal Airport (KAQP),KAQP,http://w1.weather.gov/xml/current_obs/display.php?stid=KAQP,MN
Austin Municipal (KAUM),KAUM,http://w1.weather.gov/xml/current_obs/display.php?stid=KAUM,MN
Baudette International Airport (KBDE),KBDE,http://w1.weather.gov/xml/current_obs/display.php?stid=KBDE,MN
Bemidji (KBJI),KBJI,http://w1.weather.gov/xml/current_obs/display.php?stid=KBJI,MN
Benson Municipal Airport (KBBB),KBBB,http://w1.weather.gov/xml/current_obs/display.php?stid=KBBB,MN
Bigfork Municipal Airport (KFOZ),KFOZ,http://w1.weather.gov/xml/current_obs/display.php?stid=KFOZ,MN
Brainerd - Crow Wing County Airport (KBRD),KBRD,http://w1.weather.gov/xml/current_obs/display.php?stid=KBRD,MN
"Buffalo, Buffalo Municipal Airport (KCFE)",KCFE,http://w1.weather.gov/xml/current_obs/display.php?stid=KCFE,MN
Cambridge Municipal Airport (KCBG),KCBG,http://w1.weather.gov/xml/current_obs/display.php?stid=KCBG,MN
Canby Airfield (KCNB),KCNB,http://w1.weather.gov/xml/current_obs/display.php?stid=KCNB,MN
Chisholm-Hibbing Airport (KHIB),KHIB,http://w1.weather.gov/xml/current_obs/display.php?stid=KHIB,MN
Cloquet Carlton County Airport (KCOQ),KCOQ,http://w1.weather.gov/xml/current_obs/display.php?stid=KCOQ,MN
Cook Municipal Airport (KCQM),KCQM,http://w1.weather.gov/xml/current_obs/display.php?stid=KCQM,MN
Crane Lake - Scotts Seaplane Base (KCDD),KCDD,http://w1.weather.gov/xml/current_obs/display.php?stid=KCDD,MN
Crookston Municipal Field (KCKN),KCKN,http://w1.weather.gov/xml/current_obs/display.php?stid=KCKN,MN
Detroit Lakes Airport-Wething Field (KDTL),KDTL,http://w1.weather.gov/xml/current_obs/display.php?stid=KDTL,MN
Dodge Center Airport (KTOB),KTOB,http://w1.weather.gov/xml/current_obs/display.php?stid=KTOB,MN
Downtown Holman Field (KSTP),KSTP,http://w1.weather.gov/xml/current_obs/display.php?stid=KSTP,MN
Duluth - Sky Harbor Airport (KDYT),KDYT,http://w1.weather.gov/xml/current_obs/display.php?stid=KDYT,MN
Duluth International Airport (KDLH),KDLH,http://w1.weather.gov/xml/current_obs/display.php?stid=KDLH,MN
Elbow Lake Municipal Airport (KY63),KY63,http://w1.weather.gov/xml/current_obs/display.php?stid=KY63,MN
"Ely, Ely Municipal Airport (KELO)",KELO,http://w1.weather.gov/xml/current_obs/display.php?stid=KELO,MN
Eveleth-Virginia Municipal Airport (KEVM),KEVM,http://w1.weather.gov/xml/current_obs/display.php?stid=KEVM,MN
"Fairmont, Fairmont Municipal Airport (KFRM)",KFRM,http://w1.weather.gov/xml/current_obs/display.php?stid=KFRM,MN
Falls International Airport (KINL),KINL,http://w1.weather.gov/xml/current_obs/display.php?stid=KINL,MN
"Faribault, Faribault Municipal Airport (KFBL)",KFBL,http://w1.weather.gov/xml/current_obs/display.php?stid=KFBL,MN
Fergus Falls Municipal Airport-Einar Mickel (KFFM),KFFM,http://w1.weather.gov/xml/current_obs/display.php?stid=KFFM,MN
Flag Island (KFGN),KFGN,http://w1.weather.gov/xml/current_obs/display.php?stid=KFGN,MN
"Fosston, Fosston Municipal Airport (KFSE)",KFSE,http://w1.weather.gov/xml/current_obs/display.php?stid=KFSE,MN
Glencoe Municipal Airport (KGYL),KGYL,http://w1.weather.gov/xml/current_obs/display.php?stid=KGYL,MN
Glenwood Municipal Airport (KGHW),KGHW,http://w1.weather.gov/xml/current_obs/display.php?stid=KGHW,MN
"Grand Marais, The Bay of Grand Marais (KGNA)",KGNA,http://w1.weather.gov/xml/current_obs/display.php?stid=KGNA,MN
Grand Marais/Cook County Airport (KCKC),KCKC,http://w1.weather.gov/xml/current_obs/display.php?stid=KCKC,MN
"Grand Rapids, Grand Rapids/Itasca County Airport-Gordon Newstrom Field (KGPZ)",KGPZ,http://w1.weather.gov/xml/current_obs/display.php?stid=KGPZ,MN
"Granite Falls, Granite Falls Municipal Airport/Lenzen-Roe Memorial Field (KGDB)",KGDB,http://w1.weather.gov/xml/current_obs/display.php?stid=KGDB,MN
Hallock Municipal Airport (KHCO),KHCO,http://w1.weather.gov/xml/current_obs/display.php?stid=KHCO,MN
Hinckley Field of Dreams Airport (K04W),K04W,http://w1.weather.gov/xml/current_obs/display.php?stid=K04W,MN
"Hutchinson, Hutchinson Municipal Airport-Butler Field (KHCD)",KHCD,http://w1.weather.gov/xml/current_obs/display.php?stid=KHCD,MN
"Jackson, Jackson Municipal Airport (KMJQ)",KMJQ,http://w1.weather.gov/xml/current_obs/display.php?stid=KMJQ,MN
Lake Elmo Airport (K21D),K21D,http://w1.weather.gov/xml/current_obs/display.php?stid=K21D,MN
Litchfield Municipal Airport (KLJF),KLJF,http://w1.weather.gov/xml/current_obs/display.php?stid=KLJF,MN
"Little Falls, Little Falls/Morrison County Airport-Lindbergh Field (KLXL)",KLXL,http://w1.weather.gov/xml/current_obs/display.php?stid=KLXL,MN
"Longville, Longville Municipal Airport (KXVG)",KXVG,http://w1.weather.gov/xml/current_obs/display.php?stid=KXVG,MN
"Madison, Madison-Lac Qui Parle County Airport (KDXX)",KDXX,http://w1.weather.gov/xml/current_obs/display.php?stid=KDXX,MN
Mahnomen County Airport (K3N8),K3N8,http://w1.weather.gov/xml/current_obs/display.php?stid=K3N8,MN
"Mankato, Mankato Regional Airport (KMKT)",KMKT,http://w1.weather.gov/xml/current_obs/display.php?stid=KMKT,MN
"Maple Lake, Maple Lake Municipal Airport (KMGG)",KMGG,http://w1.weather.gov/xml/current_obs/display.php?stid=KMGG,MN
"Marshall, Southwest Minnesota Regional Airport - Marshall/Ryan Field (KMML)",KMML,http://w1.weather.gov/xml/current_obs/display.php?stid=KMML,MN
Mc Gregor - Isedor Iverson Airport (KHZX),KHZX,http://w1.weather.gov/xml/current_obs/display.php?stid=KHZX,MN
Minneapolis - Flying Cloud Airport (KFCM),KFCM,http://w1.weather.gov/xml/current_obs/display.php?stid=KFCM,MN
Minneapolis / Blaine (KANE),KANE,http://w1.weather.gov/xml/current_obs/display.php?stid=KANE,MN
"Minneapolis, Airlake Airport (KLVN)",KLVN,http://w1.weather.gov/xml/current_obs/display.php?stid=KLVN,MN
"Minneapolis, Crystal Airport (KMIC)",KMIC,http://w1.weather.gov/xml/current_obs/display.php?stid=KMIC,MN
"Minneapolis, Minneapolis-St. Paul International Airport (KMSP)",KMSP,http://w1.weather.gov/xml/current_obs/display.php?stid=KMSP,MN
Montevideo-Chippewa County Airport (KMVE),KMVE,http://w1.weather.gov/xml/current_obs/display.php?stid=KMVE,MN
Moorhead Municipal Airport (KJKJ),KJKJ,http://w1.weather.gov/xml/current_obs/display.php?stid=KJKJ,MN
Moose Lake Carlton County Airport (KMZH),KMZH,http://w1.weather.gov/xml/current_obs/display.php?stid=KMZH,MN
Mora Municipal Airport (KJMR),KJMR,http://w1.weather.gov/xml/current_obs/display.php?stid=KJMR,MN
"Morris, Morris Municipal Airport (KMOX)",KMOX,http://w1.weather.gov/xml/current_obs/display.php?stid=KMOX,MN
New Ulm Municipal Airport (KULM),KULM,http://w1.weather.gov/xml/current_obs/display.php?stid=KULM,MN
Olivia Regional Airport (KOVL),KOVL,http://w1.weather.gov/xml/current_obs/display.php?stid=KOVL,MN
Orr Regional Airport (KORB),KORB,http://w1.weather.gov/xml/current_obs/display.php?stid=KORB,MN
"Ortonville, Ortonville Muncipal-Martinson Field Airport (KVVV)",KVVV,http://w1.weather.gov/xml/current_obs/display.php?stid=KVVV,MN
Owatonna Degner Regional Airport (KOWA),KOWA,http://w1.weather.gov/xml/current_obs/display.php?stid=KOWA,MN
Park Rapids Municipal Airport (KPKD),KPKD,http://w1.weather.gov/xml/current_obs/display.php?stid=KPKD,MN
"Paynesville, Paynesville Municipal Airport (KPEX)",KPEX,http://w1.weather.gov/xml/current_obs/display.php?stid=KPEX,MN
Pine River Regional Airport (KPWC),KPWC,http://w1.weather.gov/xml/current_obs/display.php?stid=KPWC,MN
Pipestone Municipal Airport (KPQN),KPQN,http://w1.weather.gov/xml/current_obs/display.php?stid=KPQN,MN
"Preston, Fillmore County Airport (KFKA)",KFKA,http://w1.weather.gov/xml/current_obs/display.php?stid=KFKA,MN
Princeton (KPNM),KPNM,http://w1.weather.gov/xml/current_obs/display.php?stid=KPNM,MN
Quentin Aanenson Field Airport (KLYV),KLYV,http://w1.weather.gov/xml/current_obs/display.php?stid=KLYV,MN
Redwood Falls Municipal Airport (KRWF),KRWF,http://w1.weather.gov/xml/current_obs/display.php?stid=KRWF,MN
Rochester - St. Mary's Hospital Heliport (K9MN),K9MN,http://w1.weather.gov/xml/current_obs/display.php?stid=K9MN,MN
"Rochester, Rochester International Airport (KRST)",KRST,http://w1.weather.gov/xml/current_obs/display.php?stid=KRST,MN
"Roseau, Roseau Municipal Airport/Rudy Billberg Field (KROX)",KROX,http://w1.weather.gov/xml/current_obs/display.php?stid=KROX,MN
Rush City Regional Airport (KROS),KROS,http://w1.weather.gov/xml/current_obs/display.php?stid=KROS,MN
Sauk Centre Municipal Airport (KD39),KD39,http://w1.weather.gov/xml/current_obs/display.php?stid=KD39,MN
Silver Bay (KBFW),KBFW,http://w1.weather.gov/xml/current_obs/display.php?stid=KBFW,MN
Slayton Municipal Airport (KDVP),KDVP,http://w1.weather.gov/xml/current_obs/display.php?stid=KDVP,MN
South St. Paul Municipal-Richard E. Flemi (KSGS),KSGS,http://w1.weather.gov/xml/current_obs/display.php?stid=KSGS,MN
St. Cloud Regional Airport (KSTC),KSTC,http://w1.weather.gov/xml/current_obs/display.php?stid=KSTC,MN
St. James Municipal Airport (KJYG),KJYG,http://w1.weather.gov/xml/current_obs/display.php?stid=KJYG,MN
Stanton Airfield (KSYN),KSYN,http://w1.weather.gov/xml/current_obs/display.php?stid=KSYN,MN
"Staples, Staples Municipal Airport (KSAZ)",KSAZ,http://w1.weather.gov/xml/current_obs/display.php?stid=KSAZ,MN
"Thief River Falls, Thief River Falls Regional Airport (KTVF)",KTVF,http://w1.weather.gov/xml/current_obs/display.php?stid=KTVF,MN
Todd Field Airport (K14Y),K14Y,http://w1.weather.gov/xml/current_obs/display.php?stid=K14Y,MN
"Tracy, Tracy Municipal Airport (KTKC)",KTKC,http://w1.weather.gov/xml/current_obs/display.php?stid=KTKC,MN
Two Harbors (KTWM),KTWM,http://w1.weather.gov/xml/current_obs/display.php?stid=KTWM,MN
Wadena Municipal Airport (KADC),KADC,http://w1.weather.gov/xml/current_obs/display.php?stid=KADC,MN
Walker Municipal Airport (KY49),KY49,http://w1.weather.gov/xml/current_obs/display.php?stid=KY49,MN
Warroad International Memorial Airport (KRRT),KRRT,http://w1.weather.gov/xml/current_obs/display.php?stid=KRRT,MN
Waseca Municipal Airport (KACQ),KACQ,http://w1.weather.gov/xml/current_obs/display.php?stid=KACQ,MN
Waskish Municipal Airport (KVWU),KVWU,http://w1.weather.gov/xml/current_obs/display.php?stid=KVWU,MN
Wheaton Municipal Airport (KETH),KETH,http://w1.weather.gov/xml/current_obs/display.php?stid=KETH,MN
Willmar Municipal Airport - John L. Rice Field (KBDH),KBDH,http://w1.weather.gov/xml/current_obs/display.php?stid=KBDH,MN
Windom Municipal Airport (KMWM),KMWM,http://w1.weather.gov/xml/current_obs/display.php?stid=KMWM,MN
"Winona, Winona Municipal Airport-Max Conrad Field (KONA)",KONA,http://w1.weather.gov/xml/current_obs/display.php?stid=KONA,MN
"Worthington, Worthington Municipal Airport (KOTG)",KOTG,http://w1.weather.gov/xml/current_obs/display.php?stid=KOTG,MN
Branson (KBBG),KBBG,http://w1.weather.gov/xml/current_obs/display.php?stid=KBBG,MO
Branson West Muni - Emerson Field (KFWB),KFWB,http://w1.weather.gov/xml/current_obs/display.php?stid=KFWB,MO
Camdenton Memorial Airport (KOZS),KOZS,http://w1.weather.gov/xml/current_obs/display.php?stid=KOZS,MO
"Cape Girardeau, Cape Girardeau Regional Airport (KCGI)",KCGI,http://w1.weather.gov/xml/current_obs/display.php?stid=KCGI,MO
"Chillicothe, Chillicothe Agri-Science Center (KCDJ)",KCDJ,http://w1.weather.gov/xml/current_obs/display.php?stid=KCDJ,MO
"Clinton, MO (KGLY)",KGLY,http://w1.weather.gov/xml/current_obs/display.php?stid=KGLY,MO
"Columbia, Columbia Regional Airport (KCOU)",KCOU,http://w1.weather.gov/xml/current_obs/display.php?stid=KCOU,MO
Farmington Airport (KFAM),KFAM,http://w1.weather.gov/xml/current_obs/display.php?stid=KFAM,MO
Fort Leonard Wood (KTBN),KTBN,http://w1.weather.gov/xml/current_obs/display.php?stid=KTBN,MO
Hannibal Regional Airport (KHAE),KHAE,http://w1.weather.gov/xml/current_obs/display.php?stid=KHAE,MO
Harrisonville Lawrence Smith Memorial Airport (KLRY),KLRY,http://w1.weather.gov/xml/current_obs/display.php?stid=KLRY,MO
"Jefferson City, Jefferson City Memorial Airport (KJEF)",KJEF,http://w1.weather.gov/xml/current_obs/display.php?stid=KJEF,MO
Jesse Viertel Memorial Airport (KVER),KVER,http://w1.weather.gov/xml/current_obs/display.php?stid=KVER,MO
"Joplin, Joplin Regional Airport (KJLN)",KJLN,http://w1.weather.gov/xml/current_obs/display.php?stid=KJLN,MO
"Kaiser Lake Ozark, Lee C Fine Memorial Airport (KAIZ)",KAIZ,http://w1.weather.gov/xml/current_obs/display.php?stid=KAIZ,MO
"Kansas City, Kansas City Downtown Airport (KMKC)",KMKC,http://w1.weather.gov/xml/current_obs/display.php?stid=KMKC,MO
"Kansas City, Kansas City International Airport (KMCI)",KMCI,http://w1.weather.gov/xml/current_obs/display.php?stid=KMCI,MO
Kennett - Kennett Memorial Airport (KTKX),KTKX,http://w1.weather.gov/xml/current_obs/display.php?stid=KTKX,MO
"Kirksville, Kirksville Regional Airport (KIRK)",KIRK,http://w1.weather.gov/xml/current_obs/display.php?stid=KIRK,MO
LEBANON (KLBO),KLBO,http://w1.weather.gov/xml/current_obs/display.php?stid=KLBO,MO
"Lee's Summit, Lee's Summit Municipal Airport (KLXT)",KLXT,http://w1.weather.gov/xml/current_obs/display.php?stid=KLXT,MO
Malden Municipal Airport (KMAW),KMAW,http://w1.weather.gov/xml/current_obs/display.php?stid=KMAW,MO
Marshall Memorial Municipal Airport (KMHL),KMHL,http://w1.weather.gov/xml/current_obs/display.php?stid=KMHL,MO
Maryville Northwest Missouri Regional Airport (KEVU),KEVU,http://w1.weather.gov/xml/current_obs/display.php?stid=KEVU,MO
Mexico Memorial Airport (KMYJ),KMYJ,http://w1.weather.gov/xml/current_obs/display.php?stid=KMYJ,MO
Monett (KHFJ),KHFJ,http://w1.weather.gov/xml/current_obs/display.php?stid=KHFJ,MO
