ObservationLocation                    ,ObservationCode,ObservationURL,ObservationState
Marco Island Airport (KMKY),KMKY,http://w1.weather.gov/xml/current_obs/display.php?stid=KMKY,FL
Marianna Municipal Airport (KMAI),KMAI,http://w1.weather.gov/xml/current_obs/display.php?stid=KMAI,FL
Mayport Naval Station - Adm David L. McDonald Field (KNRB),KNRB,http://w1.weather.gov/xml/current_obs/display.php?stid=KNRB,FL
Melbourne International Airport (KMLB),KMLB,http://w1.weather.gov/xml/current_obs/display.php?stid=KMLB,FL
"Miami, Kendall-Tamiami Executive Airport (KTMB)",KTMB,http://w1.weather.gov/xml/current_obs/display.php?stid=KTMB,FL
"Miami, Miami International Airport (KMIA)",KMIA,http://w1.weather.gov/xml/current_obs/display.php?stid=KMIA,FL
"Miami, Opa Locka Airport (KOPF)",KOPF,http://w1.weather.gov/xml/current_obs/display.php?stid=KOPF,FL
Milton - Whiting Field Naval Air Station North (KNSE),KNSE,http://w1.weather.gov/xml/current_obs/display.php?stid=KNSE,FL
"Milton, Whiting Field South (KNDZ)",KNDZ,http://w1.weather.gov/xml/current_obs/display.php?stid=KNDZ,FL
"Naples, Naples Municipal Airport (KAPF)",KAPF,http://w1.weather.gov/xml/current_obs/display.php?stid=KAPF,FL
New Smyrna Beach Municipal Airport (KEVB),KEVB,http://w1.weather.gov/xml/current_obs/display.php?stid=KEVB,FL
Northeast Florida Regional Airport (KSGJ),KSGJ,http://w1.weather.gov/xml/current_obs/display.php?stid=KSGJ,FL
Ocala International Airport - Jim Taylor Field (KOCF),KOCF,http://w1.weather.gov/xml/current_obs/display.php?stid=KOCF,FL
Okeechobee County Airport (KOBE),KOBE,http://w1.weather.gov/xml/current_obs/display.php?stid=KOBE,FL
Orlando / Sanford Airport (KSFB),KSFB,http://w1.weather.gov/xml/current_obs/display.php?stid=KSFB,FL
Orlando Executive Airport (KORL),KORL,http://w1.weather.gov/xml/current_obs/display.php?stid=KORL,FL
Orlando International Airport (KMCO),KMCO,http://w1.weather.gov/xml/current_obs/display.php?stid=KMCO,FL
"Ormond Beach, Ormond Beach Municipal Airport (KOMN)",KOMN,http://w1.weather.gov/xml/current_obs/display.php?stid=KOMN,FL
Palatka Kay Larkin Field (K28J),K28J,http://w1.weather.gov/xml/current_obs/display.php?stid=K28J,FL
Panama City - Northwest Florida Beaches International Airport (KECP),KECP,http://w1.weather.gov/xml/current_obs/display.php?stid=KECP,FL
Pensacola - Pensacola International Airport (KPNS),KPNS,http://w1.weather.gov/xml/current_obs/display.php?stid=KPNS,FL
Pensacola Naval Air Station (KNPA),KNPA,http://w1.weather.gov/xml/current_obs/display.php?stid=KNPA,FL
"Perry-Foley, Perry-Foley Airport (K40J)",K40J,http://w1.weather.gov/xml/current_obs/display.php?stid=K40J,FL
"Plant City, Plant City Municipal Airport (KPCM)",KPCM,http://w1.weather.gov/xml/current_obs/display.php?stid=KPCM,FL
"Pompano Beach, Pompano Beach Airpark (KPMP)",KPMP,http://w1.weather.gov/xml/current_obs/display.php?stid=KPMP,FL
"Punta Gorda, Charlotte County Airport (KPGD)",KPGD,http://w1.weather.gov/xml/current_obs/display.php?stid=KPGD,FL
"Sarasota / Bradenton, Sarasota-Bradenton International Airport (KSRQ)",KSRQ,http://w1.weather.gov/xml/current_obs/display.php?stid=KSRQ,FL
Sebring Regional Airport (KSEF),KSEF,http://w1.weather.gov/xml/current_obs/display.php?stid=KSEF,FL
St. Petersburg/Clearwater Airport (KPIE),KPIE,http://w1.weather.gov/xml/current_obs/display.php?stid=KPIE,FL
Suwannee County Airport (K24J),K24J,http://w1.weather.gov/xml/current_obs/display.php?stid=K24J,FL
Tallahassee - Tallahassee International Airport (KTLH),KTLH,http://w1.weather.gov/xml/current_obs/display.php?stid=KTLH,FL
"Tampa, Peter O Knight Airport (KTPF)",KTPF,http://w1.weather.gov/xml/current_obs/display.php?stid=KTPF,FL
"Tampa, Tampa International Airport (KTPA)",KTPA,http://w1.weather.gov/xml/current_obs/display.php?stid=KTPA,FL
"Tampa, Vandenberg Airport (KVDF)",KVDF,http://w1.weather.gov/xml/current_obs/display.php?stid=KVDF,FL
The Florida Keys - Marathon International Airport (KMTH),KMTH,http://w1.weather.gov/xml/current_obs/display.php?stid=KMTH,FL
The Villages (KVVG),KVVG,http://w1.weather.gov/xml/current_obs/display.php?stid=KVVG,FL
Titusville (KTIX),KTIX,http://w1.weather.gov/xml/current_obs/display.php?stid=KTIX,FL
"Titusville, NASA Shuttle Landing Facility (KTTS)",KTTS,http://w1.weather.gov/xml/current_obs/display.php?stid=KTTS,FL
Tri-County Airport (K1J0),K1J0,http://w1.weather.gov/xml/current_obs/display.php?stid=K1J0,FL
Tyndall Air Force Base (KPAM),KPAM,http://w1.weather.gov/xml/current_obs/display.php?stid=KPAM,FL
Tyndall Drone Runway (KTDR),KTDR,http://w1.weather.gov/xml/current_obs/display.php?stid=KTDR,FL
Valparaiso / Eglin Air Force Base (KVPS),KVPS,http://w1.weather.gov/xml/current_obs/display.php?stid=KVPS,FL
Venice Municipal Airport (KVNC),KVNC,http://w1.weather.gov/xml/current_obs/display.php?stid=KVNC,FL
"Vero Beach, Vero Beach Municipal Airport (KVRB)",KVRB,http://w1.weather.gov/xml/current_obs/display.php?stid=KVRB,FL
West Palm Beach - Palm Beach International Airport (KPBI),KPBI,http://w1.weather.gov/xml/current_obs/display.php?stid=KPBI,FL
Williston Montbrook Airport (KX60),KX60,http://w1.weather.gov/xml/current_obs/display.php?stid=KX60,FL
Winter Havens Gilbert Airport (KGIF),KGIF,http://w1.weather.gov/xml/current_obs/display.php?stid=KGIF,FL
Witham Field Airport (KSUA),KSUA,http://w1.weather.gov/xml/current_obs/display.php?stid=KSUA,FL
Zephyrhills Airport (KZPH),KZPH,http://w1.weather.gov/xml/current_obs/display.php?stid=KZPH,FL
"Alma, Bacon County Airport (KAMG)",KAMG,http://w1.weather.gov/xml/current_obs/display.php?stid=KAMG,GA
Americus Souther Field Airport (KACJ),KACJ,http://w1.weather.gov/xml/current_obs/display.php?stid=KACJ,GA
"Athens, Athens Airport (KAHN)",KAHN,http://w1.weather.gov/xml/current_obs/display.php?stid=KAHN,GA
Atlanta Regional Airport-Falcon Field (KFFC),KFFC,http://w1.weather.gov/xml/current_obs/display.php?stid=KFFC,GA
"Atlanta, De Kalb-Peachtree Airport (KPDK)",KPDK,http://w1.weather.gov/xml/current_obs/display.php?stid=KPDK,GA
"Atlanta, Hartsfield - Jackson Atlanta International Airport (KATL)",KATL,http://w1.weather.gov/xml/current_obs/display.php?stid=KATL,GA
Augusta Daniel Field (KDNL),KDNL,http://w1.weather.gov/xml/current_obs/display.php?stid=KDNL,GA
"Augusta, Bush Field (KAGS)",KAGS,http://w1.weather.gov/xml/current_obs/display.php?stid=KAGS,GA
"Bainbridge, Decatur County Industrial Air Park Airport (KBGE)",KBGE,http://w1.weather.gov/xml/current_obs/display.php?stid=KBGE,GA
Barwick Lafayette Airport (K9A5),K9A5,http://w1.weather.gov/xml/current_obs/display.php?stid=K9A5,GA
Baxley Municipal Airport (KBHC),KBHC,http://w1.weather.gov/xml/current_obs/display.php?stid=KBHC,GA
"Blakely, Early County Airport (KBIJ)",KBIJ,http://w1.weather.gov/xml/current_obs/display.php?stid=KBIJ,GA
Brunswick / Glynco (KBQK),KBQK,http://w1.weather.gov/xml/current_obs/display.php?stid=KBQK,GA
"Brunswick, Malcolm McKinnon Airport (KSSI)",KSSI,http://w1.weather.gov/xml/current_obs/display.php?stid=KSSI,GA
Butler Municipal Airport (K6A1),K6A1,http://w1.weather.gov/xml/current_obs/display.php?stid=K6A1,GA
Calhoun Tom B. David Field Airport (KCZL),KCZL,http://w1.weather.gov/xml/current_obs/display.php?stid=KCZL,GA
Camilla-Mitchell County Airport (KCXU),KCXU,http://w1.weather.gov/xml/current_obs/display.php?stid=KCXU,GA
"Canton, Cherokee County Airport (KCNI)",KCNI,http://w1.weather.gov/xml/current_obs/display.php?stid=KCNI,GA
Carrollton West Georgia Regional Airport (KCTJ),KCTJ,http://w1.weather.gov/xml/current_obs/display.php?stid=KCTJ,GA
Cartersville Airport (KVPC),KVPC,http://w1.weather.gov/xml/current_obs/display.php?stid=KVPC,GA
Claxton Evans County Airport (KCWV),KCWV,http://w1.weather.gov/xml/current_obs/display.php?stid=KCWV,GA
Cobb County International Airport - McCollum Field (KRYY),KRYY,http://w1.weather.gov/xml/current_obs/display.php?stid=KRYY,GA
"Columbus, Columbus Metropolitan Airport (KCSG)",KCSG,http://w1.weather.gov/xml/current_obs/display.php?stid=KCSG,GA
Cordele Crisp County Airport (KCKF),KCKF,http://w1.weather.gov/xml/current_obs/display.php?stid=KCKF,GA
Cornelia Habersham County Airport (KAJR),KAJR,http://w1.weather.gov/xml/current_obs/display.php?stid=KAJR,GA
Covington Municipal Airport (KCVC),KCVC,http://w1.weather.gov/xml/current_obs/display.php?stid=KCVC,GA
Dallas Paulding County Regional Airport (KPUJ),KPUJ,http://w1.weather.gov/xml/current_obs/display.php?stid=KPUJ,GA
"Douglas, Douglas Municipal Airport (KDQH)",KDQH,http://w1.weather.gov/xml/current_obs/display.php?stid=KDQH,GA
"Dublin, W H 'Bud' Barron Airport (KDBN)",KDBN,http://w1.weather.gov/xml/current_obs/display.php?stid=KDBN,GA
"Eastman, Heart of Georgia Regional Airport (KEZM)",KEZM,http://w1.weather.gov/xml/current_obs/display.php?stid=KEZM,GA
Elbert County - Patz Field (KEBA),KEBA,http://w1.weather.gov/xml/current_obs/display.php?stid=KEBA,GA
Fitzgerald Municipal Airport (KFZG),KFZG,http://w1.weather.gov/xml/current_obs/display.php?stid=KFZG,GA
Fort Benning (KLSF),KLSF,http://w1.weather.gov/xml/current_obs/display.php?stid=KLSF,GA
Franklin County Airport (K18A),K18A,http://w1.weather.gov/xml/current_obs/display.php?stid=K18A,GA
Fulton County Airport-Brown Field (KFTY),KFTY,http://w1.weather.gov/xml/current_obs/display.php?stid=KFTY,GA
"Gainesville, Gilmer Memorial Airport (KGVL)",KGVL,http://w1.weather.gov/xml/current_obs/display.php?stid=KGVL,GA
Gilmer County Airport (K49A),K49A,http://w1.weather.gov/xml/current_obs/display.php?stid=K49A,GA
"Greensboro, Greene County Regional Airport (K3J7)",K3J7,http://w1.weather.gov/xml/current_obs/display.php?stid=K3J7,GA
Griffin Spalding County Airport (K6A2),K6A2,http://w1.weather.gov/xml/current_obs/display.php?stid=K6A2,GA
Gwinnett County Airport-Briscoe Field (KLZU),KLZU,http://w1.weather.gov/xml/current_obs/display.php?stid=KLZU,GA
Hazlehurst Airport (KAZE),KAZE,http://w1.weather.gov/xml/current_obs/display.php?stid=KAZE,GA
Henry County Airport (KHMP),KHMP,http://w1.weather.gov/xml/current_obs/display.php?stid=KHMP,GA
Homerville Airport (KHOE),KHOE,http://w1.weather.gov/xml/current_obs/display.php?stid=KHOE,GA
Hunter U. S. Army Airfield (KSVN),KSVN,http://w1.weather.gov/xml/current_obs/display.php?stid=KSVN,GA
Jackson County Airport (KJCA),KJCA,http://w1.weather.gov/xml/current_obs/display.php?stid=KJCA,GA
Jasper Pickens County Airport (KJZP),KJZP,http://w1.weather.gov/xml/current_obs/display.php?stid=KJZP,GA
Jesup-Wayne County Airport (KJES),KJES,http://w1.weather.gov/xml/current_obs/display.php?stid=KJES,GA
LaGrange-Callaway Airport (KLGC),KLGC,http://w1.weather.gov/xml/current_obs/display.php?stid=KLGC,GA
Marietta / Dobbins Air Force Base (KMGE),KMGE,http://w1.weather.gov/xml/current_obs/display.php?stid=KMGE,GA
Middle Georgia Regional Airport (KMCN),KMCN,http://w1.weather.gov/xml/current_obs/display.php?stid=KMCN,GA
"Milledgeville, Baldwin County Airport (KMLJ)",KMLJ,http://w1.weather.gov/xml/current_obs/display.php?stid=KMLJ,GA
Moody Air Force Base (KVAD),KVAD,http://w1.weather.gov/xml/current_obs/display.php?stid=KVAD,GA
"Moultrie, Moultrie Municipal Airport (KMGR)",KMGR,http://w1.weather.gov/xml/current_obs/display.php?stid=KMGR,GA
"Newnan, Newnan Coweta County Airport (KCCO)",KCCO,http://w1.weather.gov/xml/current_obs/display.php?stid=KCCO,GA
Perry-Houston County Airport (KPXE),KPXE,http://w1.weather.gov/xml/current_obs/display.php?stid=KPXE,GA
Pine Mountain Harris County Airport (KPIM),KPIM,http://w1.weather.gov/xml/current_obs/display.php?stid=KPIM,GA
"Rome, R. B. Russell Airport (KRMG)",KRMG,http://w1.weather.gov/xml/current_obs/display.php?stid=KRMG,GA
Sandersville Kaolin Field Airport (KOKZ),KOKZ,http://w1.weather.gov/xml/current_obs/display.php?stid=KOKZ,GA
Savannah-Hilton Head International Airport (KSAV),KSAV,http://w1.weather.gov/xml/current_obs/display.php?stid=KSAV,GA
Southwest Georgia Regional Airport (KABY),KABY,http://w1.weather.gov/xml/current_obs/display.php?stid=KABY,GA
"Statesboro, Statesboro-Bulloch County Airport (KTBR)",KTBR,http://w1.weather.gov/xml/current_obs/display.php?stid=KTBR,GA
Swainsboro Emanuel County Airport (KSBO),KSBO,http://w1.weather.gov/xml/current_obs/display.php?stid=KSBO,GA
"Sylvania, Plantation Airpark (KJYL)",KJYL,http://w1.weather.gov/xml/current_obs/display.php?stid=KJYL,GA
"Thomaston, Thomaston-Upson County Airport (KOPN)",KOPN,http://w1.weather.gov/xml/current_obs/display.php?stid=KOPN,GA
Thomasville Regional Airport (KTVI),KTVI,http://w1.weather.gov/xml/current_obs/display.php?stid=KTVI,GA
"Thomson, Thomson-McDuffie County Airport (KHQU)",KHQU,http://w1.weather.gov/xml/current_obs/display.php?stid=KHQU,GA
Tifton Henry Tift Myers (KTMA),KTMA,http://w1.weather.gov/xml/current_obs/display.php?stid=KTMA,GA
Toccoa Le Tourneau Airport (KTOC),KTOC,http://w1.weather.gov/xml/current_obs/display.php?stid=KTOC,GA
Valdosta Regional Airport (KVLD),KVLD,http://w1.weather.gov/xml/current_obs/display.php?stid=KVLD,GA
"Vidalia, Vidalia Municipal Airport (KVDI)",KVDI,http://w1.weather.gov/xml/current_obs/display.php?stid=KVDI,GA
Warner Robins Air Force Base (KWRB),KWRB,http://w1.weather.gov/xml/current_obs/display.php?stid=KWRB,GA
"Washington, Washington-Wilkes County Airport (KIIY)",KIIY,http://w1.weather.gov/xml/current_obs/display.php?stid=KIIY,GA
"Waycross / Ware County, Ga (KAYS)",KAYS,http://w1.weather.gov/xml/current_obs/display.php?stid=KAYS,GA
"Winder, Winder-Barrow Airport (KWDR)",KWDR,http://w1.weather.gov/xml/current_obs/display.php?stid=KWDR,GA
Wright Army Airfield (Fort Stewart)/Midcoast Regional Airport (KLHW),KLHW,http://w1.weather.gov/xml/current_obs/display.php?stid=KLHW,GA
"Agana, Guam International Airport (PGUM)",PGUM,http://w1.weather.gov/xml/current_obs/display.php?stid=PGUM,GU
"Andersen, Mariana Is, Andersen Air Force Base (PGUA)",PGUA,http://w1.weather.gov/xml/current_obs/display.php?stid=PGUA,GU
"Wake Island, Wake Island Army Airfield Airport (PWAK)",PWAK,http://w1.weather.gov/xml/current_obs/display.php?stid=PWAK,GU
Bradshaw Army Air Field / Hawaii (PHSF),PHSF,http://w1.weather.gov/xml/current_obs/display.php?stid=PHSF,HI
"Hilo, Hilo International Airport (PHTO)",PHTO,http://w1.weather.gov/xml/current_obs/display.php?stid=PHTO,HI
"Honolulu, Honolulu International Airport (PHNL)",PHNL,http://w1.weather.gov/xml/current_obs/display.php?stid=PHNL,HI
"Kahului, Kahului Airport (PHOG)",PHOG,http://w1.weather.gov/xml/current_obs/display.php?stid=PHOG,HI
"Kailua / Kona, Keahole Airport (PHKO)",PHKO,http://w1.weather.gov/xml/current_obs/display.php?stid=PHKO,HI
"Kaneohe, Marine Corps Air Station (PHNG)",PHNG,http://w1.weather.gov/xml/current_obs/display.php?stid=PHNG,HI
"Kaunakakai, Molokai Airport (PHMK)",PHMK,http://w1.weather.gov/xml/current_obs/display.php?stid=PHMK,HI
"Kekaha, Pacific Missile Test Facility Barking Sands (PHBK)",PHBK,http://w1.weather.gov/xml/current_obs/display.php?stid=PHBK,HI
Lahaina - West Maui (PHJH),PHJH,http://w1.weather.gov/xml/current_obs/display.php?stid=PHJH,HI
"Lanai City, Lanai Airport (PHNY)",PHNY,http://w1.weather.gov/xml/current_obs/display.php?stid=PHNY,HI
"Lihue, Lihue Airport (PHLI)",PHLI,http://w1.weather.gov/xml/current_obs/display.php?stid=PHLI,HI
"Oahu, Kalaeloa Airport (PHJR)",PHJR,http://w1.weather.gov/xml/current_obs/display.php?stid=PHJR,HI
"Sand Island, Henderson Field Airport (PMDY)",PMDY,http://w1.weather.gov/xml/current_obs/display.php?stid=PMDY,HI
Wheeler Air Force Base / Oahu (PHHI),PHHI,http://w1.weather.gov/xml/current_obs/display.php?stid=PHHI,HI
Algona (KAXA),KAXA,http://w1.weather.gov/xml/current_obs/display.php?stid=KAXA,IA
"Ames, Ames Municipal Airport (KAMW)",KAMW,http://w1.weather.gov/xml/current_obs/display.php?stid=KAMW,IA
Ankeny Regional Airport (KIKV),KIKV,http://w1.weather.gov/xml/current_obs/display.php?stid=KIKV,IA
Atlantic (KAIO),KAIO,http://w1.weather.gov/xml/current_obs/display.php?stid=KAIO,IA
"Audubon, Audubon County Airport (KADU)",KADU,http://w1.weather.gov/xml/current_obs/display.php?stid=KADU,IA
Boone Municipal (KBNW),KBNW,http://w1.weather.gov/xml/current_obs/display.php?stid=KBNW,IA
Burlington Regional Airport (KBRL),KBRL,http://w1.weather.gov/xml/current_obs/display.php?stid=KBRL,IA
Carroll (KCIN),KCIN,http://w1.weather.gov/xml/current_obs/display.php?stid=KCIN,IA
Cedar Rapids Airport (KCID),KCID,http://w1.weather.gov/xml/current_obs/display.php?stid=KCID,IA
Centerville Municipal Airport (KTVK),KTVK,http://w1.weather.gov/xml/current_obs/display.php?stid=KTVK,IA
Chariton (KCNC),KCNC,http://w1.weather.gov/xml/current_obs/display.php?stid=KCNC,IA
Charles City (KCCY),KCCY,http://w1.weather.gov/xml/current_obs/display.php?stid=KCCY,IA
"Cherokee, Cherokee Municipal Airport (KCKP)",KCKP,http://w1.weather.gov/xml/current_obs/display.php?stid=KCKP,IA
Clarion (KCAV),KCAV,http://w1.weather.gov/xml/current_obs/display.php?stid=KCAV,IA
Clinton Municipal Airport (KCWI),KCWI,http://w1.weather.gov/xml/current_obs/display.php?stid=KCWI,IA
Council Bluffs (KCBF),KCBF,http://w1.weather.gov/xml/current_obs/display.php?stid=KCBF,IA
Creston Municipal Airport (KCSQ),KCSQ,http://w1.weather.gov/xml/current_obs/display.php?stid=KCSQ,IA
Davenport Municipal Airport (KDVN),KDVN,http://w1.weather.gov/xml/current_obs/display.php?stid=KDVN,IA
Decorah (KDEH),KDEH,http://w1.weather.gov/xml/current_obs/display.php?stid=KDEH,IA
Denison (KDNS),KDNS,http://w1.weather.gov/xml/current_obs/display.php?stid=KDNS,IA
Des Moines International Airport (KDSM),KDSM,http://w1.weather.gov/xml/current_obs/display.php?stid=KDSM,IA
Dubuque Regional Airport (KDBQ),KDBQ,http://w1.weather.gov/xml/current_obs/display.php?stid=KDBQ,IA
"Estherville, Estherville Municipal Airport (KEST)",KEST,http://w1.weather.gov/xml/current_obs/display.php?stid=KEST,IA
Fairfield Municipal Airport (KFFL),KFFL,http://w1.weather.gov/xml/current_obs/display.php?stid=KFFL,IA
Forest City Municipal Airport (KFXY),KFXY,http://w1.weather.gov/xml/current_obs/display.php?stid=KFXY,IA
Fort Dodge (KFOD),KFOD,http://w1.weather.gov/xml/current_obs/display.php?stid=KFOD,IA
Fort Madison Municipal Airport (KFSW),KFSW,http://w1.weather.gov/xml/current_obs/display.php?stid=KFSW,IA
Grinnell Municipal Airfield (KGGI),KGGI,http://w1.weather.gov/xml/current_obs/display.php?stid=KGGI,IA
"Harlan, Harlan Municipal Airport (KHNR)",KHNR,http://w1.weather.gov/xml/current_obs/display.php?stid=KHNR,IA
"Independence, Independence Municipal Airport (KIIB)",KIIB,http://w1.weather.gov/xml/current_obs/display.php?stid=KIIB,IA
Iowa City Municipal Airport (KIOW),KIOW,http://w1.weather.gov/xml/current_obs/display.php?stid=KIOW,IA
Iowa Falls Municipal Airport (KIFA),KIFA,http://w1.weather.gov/xml/current_obs/display.php?stid=KIFA,IA
Keokuk Municipal Airport (KEOK),KEOK,http://w1.weather.gov/xml/current_obs/display.php?stid=KEOK,IA
Knoxville (KOXV),KOXV,http://w1.weather.gov/xml/current_obs/display.php?stid=KOXV,IA
"Lamoni, Lamoni Municipal Airport (KLWD)",KLWD,http://w1.weather.gov/xml/current_obs/display.php?stid=KLWD,IA
Le Mars Municipal Airport (KLRJ),KLRJ,http://w1.weather.gov/xml/current_obs/display.php?stid=KLRJ,IA
"Marshalltown, Marshalltown Municipal Airport (KMIW)",KMIW,http://w1.weather.gov/xml/current_obs/display.php?stid=KMIW,IA
Mason City Municipal Airport (KMCW),KMCW,http://w1.weather.gov/xml/current_obs/display.php?stid=KMCW,IA
Monticello Regional Airport (KMXO),KMXO,http://w1.weather.gov/xml/current_obs/display.php?stid=KMXO,IA
"Mount Pleasant, Mount Pleasant Municipal Airport (KMPZ)",KMPZ,http://w1.weather.gov/xml/current_obs/display.php?stid=KMPZ,IA
Muscatine (KMUT),KMUT,http://w1.weather.gov/xml/current_obs/display.php?stid=KMUT,IA
Newton Municipal Airport - Earl Johnson Field (KTNU),KTNU,http://w1.weather.gov/xml/current_obs/display.php?stid=KTNU,IA
Oelwein Municipal Airport (KOLZ),KOLZ,http://w1.weather.gov/xml/current_obs/display.php?stid=KOLZ,IA
Orange City Municipal Airport (KORC),KORC,http://w1.weather.gov/xml/current_obs/display.php?stid=KORC,IA
Osceola Municipal Airport (KI75),KI75,http://w1.weather.gov/xml/current_obs/display.php?stid=KI75,IA
"Oskaloosa, Oskaloosa Municipal Airport (KOOA)",KOOA,http://w1.weather.gov/xml/current_obs/display.php?stid=KOOA,IA
Ottumwa Regional Airport (KOTM),KOTM,http://w1.weather.gov/xml/current_obs/display.php?stid=KOTM,IA
"Pella, Pella Municipal Airport (KPEA)",KPEA,http://w1.weather.gov/xml/current_obs/display.php?stid=KPEA,IA
Perry Municipal Airport (KPRO),KPRO,http://w1.weather.gov/xml/current_obs/display.php?stid=KPRO,IA
Red Oak (KRDK),KRDK,http://w1.weather.gov/xml/current_obs/display.php?stid=KRDK,IA
Schenck Field Airport (KICL),KICL,http://w1.weather.gov/xml/current_obs/display.php?stid=KICL,IA
Sheldon (KSHL),KSHL,http://w1.weather.gov/xml/current_obs/display.php?stid=KSHL,IA
Shenandoah Municipal (KSDA),KSDA,http://w1.weather.gov/xml/current_obs/display.php?stid=KSDA,IA
"Sioux City, Sioux Gateway Airport (KSUX)",KSUX,http://w1.weather.gov/xml/current_obs/display.php?stid=KSUX,IA
Spencer Municipal Airport (KSPW),KSPW,http://w1.weather.gov/xml/current_obs/display.php?stid=KSPW,IA
Storm Lake (KSLB),KSLB,http://w1.weather.gov/xml/current_obs/display.php?stid=KSLB,IA
"Vinton, Vinton Veterans Memorial Airpark Airport (KVTI)",KVTI,http://w1.weather.gov/xml/current_obs/display.php?stid=KVTI,IA
Washington (KAWG),KAWG,http://w1.weather.gov/xml/current_obs/display.php?stid=KAWG,IA
"Waterloo, Waterloo Municipal Airport (KALO)",KALO,http://w1.weather.gov/xml/current_obs/display.php?stid=KALO,IA
Webster City Municipal Airport (KEBS),KEBS,http://w1.weather.gov/xml/current_obs/display.php?stid=KEBS,IA
Boise Air Terminal (KBOI),KBOI,http://w1.weather.gov/xml/current_obs/display.php?stid=KBOI,ID
Boundary County Airport (K65S),K65S,http://w1.weather.gov/xml/current_obs/display.php?stid=K65S,ID
Burley Municipal Airport (KBYI),KBYI,http://w1.weather.gov/xml/current_obs/display.php?stid=KBYI,ID
Caldwell - Caldwell Industrial Airport (KEUL),KEUL,http://w1.weather.gov/xml/current_obs/display.php?stid=KEUL,ID
Challis - Challis Airport (KLLJ),KLLJ,http://w1.weather.gov/xml/current_obs/display.php?stid=KLLJ,ID
Coeur d'Alene Airport - Pappy Boyington Field (KCOE),KCOE,http://w1.weather.gov/xml/current_obs/display.php?stid=KCOE,ID
"Driggs, Driggs-Reed Memorial Airport (KDIJ)",KDIJ,http://w1.weather.gov/xml/current_obs/display.php?stid=KDIJ,ID
Grangeville - Idaho County Airport (KGIC),KGIC,http://w1.weather.gov/xml/current_obs/display.php?stid=KGIC,ID
"Hailey, Friedman Memorial Airport (KSUN)",KSUN,http://w1.weather.gov/xml/current_obs/display.php?stid=KSUN,ID
Idaho Falls Regional Airport (KIDA),KIDA,http://w1.weather.gov/xml/current_obs/display.php?stid=KIDA,ID
Jerome County Airport (KJER),KJER,http://w1.weather.gov/xml/current_obs/display.php?stid=KJER,ID
Joslin Field - Magic Valley Regional Airport (KTWF),KTWF,http://w1.weather.gov/xml/current_obs/display.php?stid=KTWF,ID
"Lewiston, Lewiston-Nez Perce County Airport (KLWS)",KLWS,http://w1.weather.gov/xml/current_obs/display.php?stid=KLWS,ID
Lowell (KP69),KP69,http://w1.weather.gov/xml/current_obs/display.php?stid=KP69,ID
McCall Airport (KMYL),KMYL,http://w1.weather.gov/xml/current_obs/display.php?stid=KMYL,ID
Mountain Home Air Force Base (KMUO),KMUO,http://w1.weather.gov/xml/current_obs/display.php?stid=KMUO,ID
Nampa Municipal Airport (KMAN),KMAN,http://w1.weather.gov/xml/current_obs/display.php?stid=KMAN,ID
"Pocatello, Pocatello Regional Airport (KPIH)",KPIH,http://w1.weather.gov/xml/current_obs/display.php?stid=KPIH,ID
"Rexburg, Rexburg-Madison County Airport (KRXE)",KRXE,http://w1.weather.gov/xml/current_obs/display.php?stid=KRXE,ID
"Salmon, Lemhi County Airport (KSMN)",KSMN,http://w1.weather.gov/xml/current_obs/display.php?stid=KSMN,ID
"Sandpoint, Sandpoint Airport (KSZT)",KSZT,http://w1.weather.gov/xml/current_obs/display.php?stid=KSZT,ID
"Stanley, Stanley Ranger Station (KSNT)",KSNT,http://w1.weather.gov/xml/current_obs/display.php?stid=KSNT,ID
Albertus Airport (KFEP),KFEP,http://w1.weather.gov/xml/current_obs/display.php?stid=KFEP,IL
Aurora Municipal Airport (KARR),KARR,http://w1.weather.gov/xml/current_obs/display.php?stid=KARR,IL
"Belleville, Scott AFB/MidAmerica Airport (KBLV)",KBLV,http://w1.weather.gov/xml/current_obs/display.php?stid=KBLV,IL
"Bloomington/Normal, Central Illinois Regional Airport at Bloomington-Normal (KBMI)",KBMI,http://w1.weather.gov/xml/current_obs/display.php?stid=KBMI,IL
Cairo Regional Airport (KCIR),KCIR,http://w1.weather.gov/xml/current_obs/display.php?stid=KCIR,IL
Carmi Municipal Airport (KCUL),KCUL,http://w1.weather.gov/xml/current_obs/display.php?stid=KCUL,IL
Centralia Municipal Airport (KENL),KENL,http://w1.weather.gov/xml/current_obs/display.php?stid=KENL,IL
"Chicago / West Chicago, Dupage Airport (KDPA)",KDPA,http://w1.weather.gov/xml/current_obs/display.php?stid=KDPA,IL
"Chicago / Wheeling, Pal-Waukee Airport (KPWK)",KPWK,http://w1.weather.gov/xml/current_obs/display.php?stid=KPWK,IL
"Chicago, Chicago Midway Airport (KMDW)",KMDW,http://w1.weather.gov/xml/current_obs/display.php?stid=KMDW,IL
"Chicago, Chicago-O'Hare International Airport (KORD)",KORD,http://w1.weather.gov/xml/current_obs/display.php?stid=KORD,IL
Chicago/Waukegan Regional Airport (KUGN),KUGN,http://w1.weather.gov/xml/current_obs/display.php?stid=KUGN,IL
"Danville, Vermilion County Airport (KDNV)",KDNV,http://w1.weather.gov/xml/current_obs/display.php?stid=KDNV,IL
De Kalb Taylor Municipal Airport (KDKB),KDKB,http://w1.weather.gov/xml/current_obs/display.php?stid=KDKB,IL
Decatur Airport (KDEC),KDEC,http://w1.weather.gov/xml/current_obs/display.php?stid=KDEC,IL
Edgar County Airport (KPRG),KPRG,http://w1.weather.gov/xml/current_obs/display.php?stid=KPRG,IL
"Effingham, Effingham County Memorial Airport (K1H2)",K1H2,http://w1.weather.gov/xml/current_obs/display.php?stid=K1H2,IL
"Fairfield, Fairfield Municipal Airport (KFWC)",KFWC,http://w1.weather.gov/xml/current_obs/display.php?stid=KFWC,IL
Flora Municipal Airport (KFOA),KFOA,http://w1.weather.gov/xml/current_obs/display.php?stid=KFOA,IL
Galesburg Municipal Airport (KGBG),KGBG,http://w1.weather.gov/xml/current_obs/display.php?stid=KGBG,IL
